{
  "constraintResults": [],
  "elements": [
    {
      "annotations": [
        {
          "attributes": [
            {
              "location": {
                "column": 20,
                "file": "tests/models/ir/views.sysml",
                "line": 8
              },
              "name": "major",
              "value": {
                "type": "integer",
                "value": 1
              }
            },
            {
              "location": {
                "column": 31,
                "file": "tests/models/ir/views.sysml",
                "line": 8
              },
              "name": "minor",
              "value": {
                "type": "integer",
                "value": 1
              }
            }
          ],
          "location": {
            "column": 5,
            "file": "tests/models/ir/views.sysml",
            "line": 8
          },
          "name": "DsmlVersion"
        }
      ],
      "attributes": [],
      "direction": null,
      "doc": null,
      "identity": "Portal",
      "kind": "Package",
      "location": {
        "column": 1,
        "file": "tests/models/ir/views.sysml",
        "line": 5
      },
      "multiplicity": null,
      "name": "Portal",
      "owner": null,
      "qualifiedName": "Portal",
      "shortName": null,
      "types": []
    },
    {
      "annotations": [],
      "attributes": [],
      "direction": null,
      "doc": null,
      "identity": "Portal::Order",
      "kind": "Entity",
      "location": {
        "column": 5,
        "file": "tests/models/ir/views.sysml",
        "line": 12
      },
      "multiplicity": null,
      "name": "Order",
      "owner": "Portal",
      "qualifiedName": "Portal::Order",
      "shortName": null,
      "types": []
    },
    {
      "annotations": [
        {
          "attributes": [],
          "location": {
            "column": 9,
            "file": "tests/models/ir/views.sysml",
            "line": 13
          },
          "name": "Key"
        }
      ],
      "attributes": [],
      "direction": null,
      "doc": null,
      "identity": "Portal::Order::id",
      "kind": "Field",
      "location": {
        "column": 9,
        "file": "tests/models/ir/views.sysml",
        "line": 13
      },
      "multiplicity": {
        "lower": 1,
        "upper": 1
      },
      "name": "id",
      "owner": "Portal::Order",
      "qualifiedName": "Portal::Order::id",
      "shortName": null,
      "types": [
        "DSML::Uuid"
      ]
    },
    {
      "annotations": [],
      "attributes": [],
      "direction": null,
      "doc": null,
      "identity": "Portal::Order::total",
      "kind": "Field",
      "location": {
        "column": 9,
        "file": "tests/models/ir/views.sysml",
        "line": 14
      },
      "multiplicity": {
        "lower": 1,
        "upper": 1
      },
      "name": "total",
      "owner": "Portal::Order",
      "qualifiedName": "Portal::Order::total",
      "shortName": null,
      "types": [
        "DSML::Decimal"
      ]
    },
    {
      "annotations": [],
      "attributes": [
        {
          "location": {
            "column": 9,
            "file": "tests/models/ir/views.sysml",
            "line": 20
          },
          "name": "method",
          "value": {
            "enumeration": "DSML::HttpMethod",
            "literal": "post",
            "type": "enum"
          }
        },
        {
          "location": {
            "column": 9,
            "file": "tests/models/ir/views.sysml",
            "line": 21
          },
          "name": "path",
          "value": {
            "type": "string",
            "value": "/orders/place"
          }
        }
      ],
      "direction": null,
      "doc": null,
      "identity": "Portal::PlaceOrder",
      "kind": "Operation",
      "location": {
        "column": 5,
        "file": "tests/models/ir/views.sysml",
        "line": 17
      },
      "multiplicity": null,
      "name": "PlaceOrder",
      "owner": "Portal",
      "qualifiedName": "Portal::PlaceOrder",
      "shortName": null,
      "types": []
    },
    {
      "annotations": [],
      "attributes": [],
      "direction": "out",
      "doc": null,
      "identity": "Portal::PlaceOrder::order",
      "kind": "Parameter",
      "location": {
        "column": 9,
        "file": "tests/models/ir/views.sysml",
        "line": 19
      },
      "multiplicity": null,
      "name": "order",
      "owner": "Portal::PlaceOrder",
      "qualifiedName": "Portal::PlaceOrder::order",
      "shortName": null,
      "types": [
        "Portal::Order"
      ]
    },
    {
      "annotations": [],
      "attributes": [],
      "direction": "in",
      "doc": null,
      "identity": "Portal::PlaceOrder::total",
      "kind": "Parameter",
      "location": {
        "column": 9,
        "file": "tests/models/ir/views.sysml",
        "line": 18
      },
      "multiplicity": null,
      "name": "total",
      "owner": "Portal::PlaceOrder",
      "qualifiedName": "Portal::PlaceOrder::total",
      "shortName": null,
      "types": [
        "DSML::Decimal"
      ]
    },
    {
      "annotations": [],
      "attributes": [
        {
          "location": null,
          "name": "literals",
          "value": {
            "items": [
              {
                "enumeration": "Portal::PortalRoles",
                "literal": "clerk",
                "type": "enum"
              },
              {
                "enumeration": "Portal::PortalRoles",
                "literal": "admin",
                "type": "enum"
              }
            ],
            "type": "list"
          }
        }
      ],
      "direction": null,
      "doc": null,
      "identity": "Portal::PortalRoles",
      "kind": "Roles",
      "location": {
        "column": 5,
        "file": "tests/models/ir/views.sysml",
        "line": 10
      },
      "multiplicity": null,
      "name": "PortalRoles",
      "owner": "Portal",
      "qualifiedName": "Portal::PortalRoles",
      "shortName": null,
      "types": []
    },
    {
      "annotations": [],
      "attributes": [
        {
          "location": {
            "column": 9,
            "file": "tests/models/ir/views.sysml",
            "line": 64
          },
          "name": "navigation",
          "value": {
            "items": [
              {
                "target": "Portal::adminPortal::orderAdmin",
                "type": "reference"
              }
            ],
            "type": "list"
          }
        },
        {
          "location": {
            "column": 9,
            "file": "tests/models/ir/views.sysml",
            "line": 58
          },
          "name": "target",
          "value": {
            "enumeration": "DSML::Target",
            "literal": "react",
            "type": "enum"
          }
        }
      ],
      "direction": null,
      "doc": null,
      "identity": "Portal::adminPortal",
      "kind": "Application",
      "location": {
        "column": 5,
        "file": "tests/models/ir/views.sysml",
        "line": 57
      },
      "multiplicity": null,
      "name": "adminPortal",
      "owner": "Portal",
      "qualifiedName": "Portal::adminPortal",
      "shortName": null,
      "types": []
    },
    {
      "annotations": [],
      "attributes": [
        {
          "location": {
            "column": 13,
            "file": "tests/models/ir/views.sysml",
            "line": 62
          },
          "name": "allowedRoles",
          "value": {
            "items": [
              {
                "enumeration": "Portal::PortalRoles",
                "literal": "admin",
                "type": "enum"
              }
            ],
            "type": "list"
          }
        },
        {
          "location": {
            "column": 13,
            "file": "tests/models/ir/views.sysml",
            "line": 61
          },
          "name": "entity",
          "value": {
            "target": "Portal::Order",
            "type": "reference"
          }
        },
        {
          "location": {
            "column": 13,
            "file": "tests/models/ir/views.sysml",
            "line": 60
          },
          "name": "kind",
          "value": {
            "enumeration": "DSML::ViewKind",
            "literal": "list",
            "type": "enum"
          }
        },
        {
          "location": null,
          "name": "public",
          "value": {
            "type": "boolean",
            "value": false
          }
        }
      ],
      "direction": null,
      "doc": null,
      "identity": "Portal::adminPortal::orderAdmin",
      "kind": "View",
      "location": {
        "column": 9,
        "file": "tests/models/ir/views.sysml",
        "line": 59
      },
      "multiplicity": null,
      "name": "orderAdmin",
      "owner": "Portal::adminPortal",
      "qualifiedName": "Portal::adminPortal::orderAdmin",
      "shortName": null,
      "types": []
    },
    {
      "annotations": [],
      "attributes": [],
      "direction": null,
      "doc": null,
      "identity": "Portal::adminSite",
      "kind": "StaticSite",
      "location": {
        "column": 5,
        "file": "tests/models/ir/views.sysml",
        "line": 70
      },
      "multiplicity": null,
      "name": "adminSite",
      "owner": "Portal",
      "qualifiedName": "Portal::adminSite",
      "shortName": null,
      "types": []
    },
    {
      "annotations": [],
      "attributes": [],
      "direction": null,
      "doc": null,
      "identity": "Portal::adminSiteAws",
      "kind": "AwsStaticSite",
      "location": {
        "column": 5,
        "file": "tests/models/ir/views.sysml",
        "line": 80
      },
      "multiplicity": null,
      "name": "adminSiteAws",
      "owner": "Portal",
      "qualifiedName": "Portal::adminSiteAws",
      "shortName": null,
      "types": []
    },
    {
      "annotations": [],
      "attributes": [],